{
  "student_id": "advanced_student",
  "name": "Advanced Student",
  "created_at": "2025-01-03T09:00:00",
  "metadata": {
    "synthetic": true,
    "persona": "advanced",
    "description": "Late-stage learner with deep mathematics and physics coverage, competent computer science, and only an introductory brush with chemistry. Learns quickly and reviews little.",
    "disclaimer": "Synthetic research persona generated by stepzero.student_profiles. This is designed test material, not observed data, and it is not derived from or calibrated against any real student. It exists to give Project Step Zero v1.0 controlled, reproducible inputs for recommendation, simulation, and evaluation experiments, and is expected to be replaced or calibrated once primary research data is collected.",
    "generator_version": "1.0",
    "design_notes": [
      "Full mathematics coverage is what makes the deep physics track reachable at all.",
      "Chemistry reach is deliberately shallow so the profile is strong but not uniformly strong.",
      "probability_distributions is a deliberate gap from avoiding the statistics track.",
      "euclidean_basics is deliberately forgotten, an early topic never revisited in years."
    ]
  },
  "progress": {
    "chemistry.atomic_structure.atomic_theory": {
      "concept_id": "chemistry.atomic_structure.atomic_theory",
      "status": "mastered",
      "mastery_score": 0.8306,
      "attempts": 2,
      "time_spent_hours": 3.53,
      "self_rated_confidence": 0.91,
      "first_studied_at": "2025-01-06T12:00:00",
      "last_reviewed_at": "2025-01-16T12:00:00",
      "completed_at": "2025-01-16T12:00:00"
    },
    "chemistry.stoichiometry.moles_stoichiometry": {
      "concept_id": "chemistry.stoichiometry.moles_stoichiometry",
      "status": "mastered",
      "mastery_score": 0.8968,
      "attempts": 2,
      "time_spent_hours": 5.71,
      "self_rated_confidence": 0.92,
      "first_studied_at": "2025-01-16T17:00:00",
      "last_reviewed_at": "2025-01-26T17:00:00",
      "completed_at": "2025-01-26T17:00:00"
    },
    "chemistry.states_of_matter.gas_laws": {
      "concept_id": "chemistry.states_of_matter.gas_laws",
      "status": "mastered",
      "mastery_score": 0.8755,
      "attempts": 2,
      "time_spent_hours": 4.98,
      "self_rated_confidence": 0.91,
      "first_studied_at": "2025-01-25T14:00:00",
      "last_reviewed_at": "2025-02-02T14:00:00",
      "completed_at": "2025-02-02T14:00:00"
    },
    "mathematics.arithmetic.number_sense": {
      "concept_id": "mathematics.arithmetic.number_sense",
      "status": "mastered",
      "mastery_score": 0.9457,
      "attempts": 2,
      "time_spent_hours": 1.78,
      "self_rated_confidence": 1.0,
      "first_studied_at": "2025-02-04T13:00:00",
      "last_reviewed_at": "2025-02-14T13:00:00",
      "completed_at": "2025-02-14T13:00:00"
    },
    "computer_science.foundations.number_systems": {
      "concept_id": "computer_science.foundations.number_systems",
      "status": "mastered",
      "mastery_score": 0.8902,
      "attempts": 1,
      "time_spent_hours": 2.2,
      "self_rated_confidence": 0.96,
      "first_studied_at": "2025-02-14T17:00:00",
      "last_reviewed_at": "2025-02-17T17:00:00",
      "completed_at": "2025-02-17T17:00:00"
    },
    "computer_science.foundations.boolean_logic": {
      "concept_id": "computer_science.foundations.boolean_logic",
      "status": "mastered",
      "mastery_score": 0.8961,
      "attempts": 2,
      "time_spent_hours": 3.42,
      "self_rated_confidence": 0.96,
      "first_studied_at": "2025-02-23T13:00:00",
      "last_reviewed_at": "2025-03-01T13:00:00",
      "completed_at": "2025-03-01T13:00:00"
    },
    "computer_science.programming.variables_and_types": {
      "concept_id": "computer_science.programming.variables_and_types",
      "status": "mastered",
      "mastery_score": 0.9134,
      "attempts": 1,
      "time_spent_hours": 2.16,
      "self_rated_confidence": 0.94,
      "first_studied_at": "2025-03-05T15:00:00",
      "last_reviewed_at": "2025-03-10T15:00:00",
      "completed_at": "2025-03-10T15:00:00"
    },
    "computer_science.data_structures.arrays": {
      "concept_id": "computer_science.data_structures.arrays",
      "status": "mastered",
      "mastery_score": 0.8827,
      "attempts": 2,
      "time_spent_hours": 3.66,
      "self_rated_confidence": 0.9,
      "first_studied_at": "2025-03-15T13:00:00",
      "last_reviewed_at": "2025-03-23T13:00:00",
      "completed_at": "2025-03-23T13:00:00"
    },
    "computer_science.algorithms.searching_algorithms": {
      "concept_id": "computer_science.algorithms.searching_algorithms",
      "status": "mastered",
      "mastery_score": 0.8595,
      "attempts": 1,
      "time_spent_hours": 2.94,
      "self_rated_confidence": 0.93,
      "first_studied_at": "2025-03-24T11:00:00",
      "last_reviewed_at": "2025-03-28T11:00:00",
      "completed_at": "2025-03-28T11:00:00"
    },
    "computer_science.data_structures.linked_lists": {
      "concept_id": "computer_science.data_structures.linked_lists",
      "status": "mastered",
      "mastery_score": 0.8305,
      "attempts": 2,
      "time_spent_hours": 5.21,
      "self_rated_confidence": 0.88,
      "first_studied_at": "2025-04-03T15:00:00",
      "last_reviewed_at": "2025-04-09T15:00:00",
      "completed_at": "2025-04-09T15:00:00"
    },
    "computer_science.data_structures.stacks_queues": {
      "concept_id": "computer_science.data_structures.stacks_queues",
      "status": "mastered",
      "mastery_score": 0.8243,
      "attempts": 2,
      "time_spent_hours": 3.64,
      "self_rated_confidence": 0.87,
      "first_studied_at": "2025-04-13T15:00:00",
      "last_reviewed_at": "2025-04-23T15:00:00",
      "completed_at": "2025-04-23T15:00:00"
    },
    "mathematics.algebra.variables_expressions": {
      "concept_id": "mathematics.algebra.variables_expressions",
      "status": "mastered",
      "mastery_score": 0.8841,
      "attempts": 2,
      "time_spent_hours": 2.73,
      "self_rated_confidence": 0.92,
      "first_studied_at": "2025-04-22T12:00:00",
      "last_reviewed_at": "2025-04-29T12:00:00",
      "completed_at": "2025-04-29T12:00:00"
    },
    "mathematics.algebra.functions": {
      "concept_id": "mathematics.algebra.functions",
      "status": "mastered",
      "mastery_score": 0.923,
      "attempts": 1,
      "time_spent_hours": 2.87,
      "self_rated_confidence": 0.93,
      "first_studied_at": "2025-05-02T18:00:00",
      "last_reviewed_at": "2025-05-05T18:00:00",
      "completed_at": "2025-05-05T18:00:00"
    },
    "computer_science.theory.discrete_math_foundations": {
      "concept_id": "computer_science.theory.discrete_math_foundations",
      "status": "mastered",
      "mastery_score": 0.8957,
      "attempts": 1,
      "time_spent_hours": 4.23,
      "self_rated_confidence": 0.95,
      "first_studied_at": "2025-05-12T15:00:00",
      "last_reviewed_at": "2025-05-16T15:00:00",
      "completed_at": "2025-05-16T15:00:00"
    },
    "mathematics.algebra.exponents_logarithms": {
      "concept_id": "mathematics.algebra.exponents_logarithms",
      "status": "mastered",
      "mastery_score": 0.8572,
      "attempts": 2,
      "time_spent_hours": 5.42,
      "self_rated_confidence": 0.88,
      "first_studied_at": "2025-05-21T18:00:00",
      "last_reviewed_at": "2025-05-27T18:00:00",
      "completed_at": "2025-05-27T18:00:00"
    },
    "mathematics.algebra.linear_equations": {
      "concept_id": "mathematics.algebra.linear_equations",
      "status": "mastered",
      "mastery_score": 0.9147,
      "attempts": 1,
      "time_spent_hours": 3.2,
      "self_rated_confidence": 0.94,
      "first_studied_at": "2025-05-31T10:00:00",
      "last_reviewed_at": "2025-06-04T10:00:00",
      "completed_at": "2025-06-04T10:00:00"
    },
    "mathematics.algebra.inequalities": {
      "concept_id": "mathematics.algebra.inequalities",
      "status": "mastered",
      "mastery_score": 0.8501,
      "attempts": 2,
      "time_spent_hours": 3.35,
      "self_rated_confidence": 0.91,
      "first_studied_at": "2025-06-09T14:00:00",
      "last_reviewed_at": "2025-06-19T14:00:00",
      "completed_at": "2025-06-19T14:00:00"
    },
    "mathematics.algebra.polynomials": {
      "concept_id": "mathematics.algebra.polynomials",
      "status": "mastered",
      "mastery_score": 0.8466,
      "attempts": 2,
      "time_spent_hours": 6.03,
      "self_rated_confidence": 0.9,
      "first_studied_at": "2025-06-19T11:00:00",
      "last_reviewed_at": "2025-06-28T11:00:00",
      "completed_at": "2025-06-28T11:00:00"
    },
    "mathematics.algebra.quadratic_equations": {
      "concept_id": "mathematics.algebra.quadratic_equations",
      "status": "mastered",
      "mastery_score": 0.8398,
      "attempts": 2,
      "time_spent_hours": 4.84,
      "self_rated_confidence": 0.86,
      "first_studied_at": "2025-06-29T12:00:00",
      "last_reviewed_at": "2025-07-05T12:00:00",
      "completed_at": "2025-07-05T12:00:00"
    },
    "mathematics.algebra.systems_of_equations": {
      "concept_id": "mathematics.algebra.systems_of_equations",
      "status": "mastered",
      "mastery_score": 0.8629,
      "attempts": 1,
      "time_spent_hours": 3.67,
      "self_rated_confidence": 0.92,
      "first_studied_at": "2025-07-08T10:00:00",
      "last_reviewed_at": "2025-07-12T10:00:00",
      "completed_at": "2025-07-12T10:00:00"
    },
    "mathematics.geometry.euclidean_basics": {
      "concept_id": "mathematics.geometry.euclidean_basics",
      "status": "mastered",
      "mastery_score": 0.4533,
      "attempts": 2,
      "time_spent_hours": 4.14,
      "self_rated_confidence": 0.52,
      "first_studied_at": "2025-07-18T18:00:00",
      "last_reviewed_at": "2025-07-27T18:00:00",
      "completed_at": "2025-07-27T18:00:00"
    },
    "mathematics.geometry.coordinate_geometry": {